{
  "schemaVersion": 1,
  "id": "lmstudio",
  "name": "LM Studio Local",
  "adapter": "openai-compatible",
  "baseUrl": "http://127.0.0.1:1234/v1",
  "trustLevel": "official",
  "auth": {
    "type": "none",
    "headerName": null
  },
  "endpoints": {
    "models": "/models",
    "responses": null,
    "chatCompletions": "/chat/completions"
  },
  "extraHeaders": {},
  "capabilities": [
    "local",
    "text"
  ]
}